{
  "schema_version": "1.0.0",
  "package_id": "33333333-3333-4333-8333-333333333333",
  "survey_id": "11111111-1111-4111-8111-111111111111",
  "asset_copy_id": "asset_demo",
  "package_hash": "aaaaaaaaaaaaaaaaaaaaaaaaaaaaaaaaaaaaaaaaaaaaaaaaaaaaaaaaaaaaaaaa",
  "task": "condition",
  "evidence_refs": ["roomplan_structure"],
  "ocr_candidates": [],
  "catalog_candidates": [],
  "spatial_context": null,
  "operator_note": null,
  "deterministic_flags": {"high_value": false}
}

